{
  "schemaVersion": "1.0.0",
  "channelId": "tip-ogrencileri-platformu",
  "editorialBrand": "Hekimler Topluluğu",
  "policyId": "hekimler-source-policy-map",
  "approvalStatus": "USER_APPROVED",
  "approvedAt": "2026-09-19",
  "purpose": "Declarative Source Policy Map that routes every source item for Turkish medical students, interns, residents, physicians, and early-career medical professionals. Not a generic healthcare-news crawler. Authority or viral potential alone never decides publication.",
  "notInScope": [
    "Generic consumer-health lifestyle crawler",
    "Raw legal dumps without impact transform",
    "Faculty/curator Instagram as growth engine",
    "Life/nöbet culture column as a required early-phase pool",
    "Invented evidence or AI-as-source",
    "Copying wording/visuals/claims from trend reference accounts",
    "Drug/supplement/treatment-promise advertising as primary revenue content"
  ],
  "audience": {
    "segments": [
      {
        "id": "medical_student",
        "label": "Turkish medical students"
      },
      {
        "id": "intern",
        "label": "Interns (intörn)"
      },
      {
        "id": "resident",
        "label": "Residents (asistan)"
      },
      {
        "id": "early_career_physician",
        "label": "Early-career physicians / young specialists"
      },
      {
        "id": "physician",
        "label": "Physicians in clinical practice"
      },
      {
        "id": "academic_physician",
        "label": "Academic physicians (guest/prestige/source; not primary algorithmic target)",
        "notes": "Include only when directly relevant to training, specialty education, or research opportunity."
      },
      {
        "id": "dental_student",
        "label": "Dental students (diş hekimliği öğrencileri)"
      },
      {
        "id": "veterinary_student",
        "label": "Veterinary students"
      },
      {
        "id": "international_student_in_turkey",
        "label": "International medical/dental/veterinary students in Turkey"
      },
      {
        "id": "tus_candidate",
        "label": "TUS candidates"
      },
      {
        "id": "dus_candidate",
        "label": "DUS candidates"
      },
      {
        "id": "general_practitioner",
        "label": "General practitioners (pratisyen)"
      },
      {
        "id": "family_physician",
        "label": "Family physicians"
      },
      {
        "id": "specialist",
        "label": "Specialists and subspecialists"
      },
      {
        "id": "dentist",
        "label": "Dentists and specialist dentists/academics"
      },
      {
        "id": "veterinarian",
        "label": "Veterinarians and specialist veterinarians/academics"
      },
      {
        "id": "compulsory_service_physician",
        "label": "Physicians in compulsory service"
      },
      {
        "id": "private_practice_physician",
        "label": "Clinic/practice owners and private-sector physicians"
      },
      {
        "id": "physician_researcher",
        "label": "Physician researchers"
      },
      {
        "id": "abroad_aspirant",
        "label": "Aspirants for study/residency/postgraduate/work abroad, equivalence and licensing seekers, language-exam candidates"
      },
      {
        "id": "turkish_professional_abroad",
        "label": "Turkish physicians abroad and those considering return"
      }
    ],
    "primary": [
      "abroad_aspirant",
      "compulsory_service_physician",
      "dental_student",
      "dentist",
      "dus_candidate",
      "early_career_physician",
      "family_physician",
      "general_practitioner",
      "intern",
      "international_student_in_turkey",
      "medical_student",
      "physician",
      "physician_researcher",
      "private_practice_physician",
      "resident",
      "specialist",
      "turkish_professional_abroad",
      "tus_candidate",
      "veterinarian",
      "veterinary_student"
    ],
    "nonPrimary": [
      "academic_physician"
    ],
    "scopeGateRef": "content/policies/hekimler-audience-scope.json"
  },
  "routes": [
    {
      "id": "FEED",
      "purpose": "Public Instagram/community posts that are both medically relevant and shareable after required transform.",
      "viralityMayReducePriority": false
    },
    {
      "id": "PROFESSIONAL_BRIEF",
      "purpose": "Trusted professional/policy briefings; may stay off-feed or become impact cards only after transform.",
      "viralityMayReducePriority": false
    },
    {
      "id": "OPPORTUNITY",
      "purpose": "Exams, scholarships, exchange, faculty/club opportunities. Rank by eligibility, deadline, medical relevance, official verification — not virality.",
      "viralityMayReducePriority": false
    },
    {
      "id": "CONGRESS_CALENDAR",
      "purpose": "Verified congress/scientific meeting opportunities with deadlines and eligibility.",
      "viralityMayReducePriority": false
    },
    {
      "id": "ABROAD_CAREER",
      "purpose": "Official pathways for Turkish medical graduates abroad (core: US/UK/DE).",
      "viralityMayReducePriority": false
    },
    {
      "id": "TREND_INBOX",
      "purpose": "Discovery/trend signals awaiting primary corroboration. Never publish from signal alone.",
      "viralityMayReducePriority": true
    },
    {
      "id": "DISCARD",
      "purpose": "Out of audience, PR-only, generic exam noise, unverifiable claims, or policy exclusions.",
      "viralityMayReducePriority": true
    }
  ],
  "globalRules": {
    "audienceOnlyGate": "HARD RULE (user, 2026-09-20): the pipeline exists only for physicians, residents, interns and medical students. An item enters review only if it concretely affects that audience (exams, training/specialty, workforce/appointment, regulation, clinical guidance, career/abroad pathways, student opportunities). Anything else is DISCARD before it reaches the Hub. A keyword hit alone is not enough; institutional authority is not enough; a source being sparse is acceptable, a crowded queue is not. When in doubt, discard.",
    "neverAuthorityAlone": "A source must never be judged only by its institutional authority.",
    "neverViralityAlone": "A source must never be judged only by viral potential.",
    "noInventedEvidence": "Every candidate stores decision, source policy applied, evidence status, audience segments, route reason, risk flags, and primary URL when required. Missing evidence → needs-check, discovery-only, or DISCARD — never invent.",
    "aiRole": "AI may classify and summarize under these controls. AI must never invent evidence or replace a source.",
    "lifeCultureColumn": "Life/nöbet/faculty-culture is not a required early-phase content column. Allow only published surveys/reports, verifiable training changes, explicit Q&A community posts, or invited first-person pieces when available.",
    "facultyAndCuratorRole": "Faculty announcements and curated club Instagram retain students (OPPORTUNITY). They are not the account growth engine."
  },
  "sourcePolicies": [
    {
      "id": "osym",
      "label": "ÖSYM — medical exams only",
      "matchesSourceIds": [
        "osym_duyurular",
        "osym_tus",
        "osym_sts_tip",
        "osym_yds",
        "osym_yokdil"
      ],
      "source_tier": "primary",
      "source_role": "primary_official",
      "audience_segments": [
        "medical_student",
        "intern",
        "resident",
        "early_career_physician",
        "physician"
      ],
      "include_keywords": [
        "TUS",
        "STS",
        "tıp",
        "tip",
        "tıpta uzmanlık",
        "uzmanlık",
        "intörn",
        "intern",
        "YDS",
        "YÖKDİL",
        "dil",
        "sınav tarihi",
        "başvuru",
        "tercih"
      ],
      "exclude_keywords": [
        "KPSS",
        "ALES genel",
        "MSÜ",
        "YKS",
        "LGS",
        "DGS",
        "e-KPSS",
        "polis",
        "askerî öğrenci"
      ],
      "allowed_routes": [
        "OPPORTUNITY",
        "PROFESSIONAL_BRIEF",
        "DISCARD"
      ],
      "default_route": "OPPORTUNITY",
      "required_evidence": [
        "official_osym_url",
        "exam_or_process_name",
        "who_is_affected",
        "what_changed_or_deadline"
      ],
      "required_transform": [
        "impact_card",
        "opportunity_card"
      ],
      "score_boosts": [
        {
          "when": "direct medical-specialty or medical-school exam relevance",
          "effect": "boost OPPORTUNITY medical_relevance"
        },
        {
          "when": "clear deadline within actionable window",
          "effect": "boost OPPORTUNITY urgency"
        }
      ],
      "score_penalties": [
        {
          "when": "generic national exam with no medical pathway link",
          "effect": "force DISCARD"
        }
      ],
      "commercial_sensitivity": "none",
      "primary_url_required": true,
      "viralityMustNotReduceOpportunity": true,
      "rules": [
        "Include only medical-school, medical-specialty, and directly relevant exam items.",
        "Discard generic exam noise.",
        "Convert valid items into what-changed / who-is-affected / deadline / action cards.",
        "Low virality must not reduce OPPORTUNITY priority."
      ]
    },
    {
      "id": "yok-yokak",
      "label": "YÖK / YÖKAK — medical education only",
      "matchesSourceIds": [
        "yok_duyurular",
        "yokak_ogrenci_katilimi"
      ],
      "source_tier": "primary",
      "source_role": "primary_official",
      "audience_segments": [
        "medical_student",
        "intern",
        "resident",
        "academic_physician",
        "early_career_physician"
      ],
      "include_keywords": [
        "tıp fakülte",
        "tıp eğitimi",
        "akreditasyon",
        "kontenjan",
        "uzmanlık eğitimi",
        "tıpta uzmanlık",
        "asistan",
        "akademik tıp",
        "öğretim üyesi tıp",
        "YÖKAK",
        "program yeterlilik"
      ],